{
  "decision_brief_id": "DB-DEMO-001",
  "version": 1,
  "opportunity_ref": "O-DEMO-001",
  "state": "signed",
  "recommendation": "EXPERIMENT",
  "rationale": "The commercial proposal is useful, but model synthesis alone cannot validate the target-user problem.",
  "acknowledged_counterevidence_refs": [],
  "projected_experiment_cost": {"amount": 250, "currency": "USD"},
  "cheaper_sufficient_experiment": {
    "action_id": "X-INTERVIEW-001",
    "type": "interview",
    "description": "Interview two target product leads and retain both supporting and contradictory observations.",
    "decision_to_unlock": "Determine whether the governed handoff solves a concrete recurring team problem.",
    "estimated_cost": {"amount": 0, "currency": "USD"},
    "deadline": "2030-07-18T12:00:00Z"
  },
  "owner": "human:product-lead",
  "approved_by": "platform:demo-fixture-signer",
  "approved_at": "2026-07-17T12:00:00Z",
  "signing_provenance": "demo_fixture",
  "created_at": "2026-07-17T12:00:00Z",
  "updated_at": "2026-07-17T12:00:00Z"
}
