{
  "decision_brief_id": "DB-UNDERSTAND-VIDEO-002",
  "version": 2,
  "opportunity_ref": "O-UNDERSTAND-VIDEO-001",
  "state": "draft",
  "recommendation": "MVP",
  "rationale": "Sequence a one-developer technical Stage A before external distribution. The existing feasibility experiment and repository-owner review support a narrowly bounded local build, while the observed electronic-voice and caption-overlap defects must be fixed before delivery. Independent learner value remains explicitly unproven and moves to Stage B.",
  "acknowledged_counterevidence_refs": [
    "E-PREFERENCE-CODE-REVIEW-001",
    "E-REPORTED-LEARNING-COMPARISON-001",
    "E-HUMAN-MEDIA-REVIEW-001",
    "E-HUMAN-MEDIA-DEFECTS-001"
  ],
  "projected_experiment_cost": {
    "amount": 25,
    "currency": "USD"
  },
  "cheaper_sufficient_experiment": null,
  "owner": "human:repository-owner",
  "approved_by": null,
  "approved_at": null,
  "signing_provenance": null,
  "created_at": "2026-07-17T14:22:50Z",
  "updated_at": "2026-07-18T14:46:00Z"
}
