{
  "decision_brief_id": "DB-DEMO-002",
  "version": 2,
  "opportunity_ref": "O-DEMO-001",
  "state": "signed",
  "recommendation": "MVP",
  "rationale": "The labeled fixture observations exercise both support and contradiction handling; for the demo only, an MVP is the next bounded experiment.",
  "acknowledged_counterevidence_refs": ["E-INTERVIEW-B"],
  "projected_experiment_cost": {"amount": 250, "currency": "USD"},
  "cheaper_sufficient_experiment": null,
  "owner": "human:product-lead",
  "approved_by": "platform:demo-fixture-signer",
  "approved_at": "2026-07-17T13:00:00Z",
  "signing_provenance": "demo_fixture",
  "created_at": "2026-07-17T12:00:00Z",
  "updated_at": "2026-07-17T13:00:00Z"
}
